{
  "adapter_entry": "live/carrier.py",
  "adapter_id": "claude-code",
  "binary": "claude",
  "capabilities": {
    "loaded_context_digest": false,
    "loaded_skill_digest": false,
    "offline": false,
    "session_resume": true,
    "streaming": true,
    "structured_output": true
  },
  "classification": "GRAY_BOX",
  "content_digest": "sha256:3feab33ddb922a0e541177d5eb59fe47d489b6bc2b48cf3a350b5a23f393c386",
  "host_id": "claude-code",
  "implementation_state": "IMPLEMENTED",
  "instruction_routes": [
    "CLAUDE.md",
    "AGENTS.md"
  ],
  "schema_version": "loopx/worker-adapter/v1",
  "skill_roots": [
    ".claude/skills"
  ],
  "source_identity": null,
  "trace_ceiling": "PROCESS_ONLY",
  "transport": "CLI",
  "version_argv": [
    "--version"
  ]
}
